<?xml version="1.0" encoding="UTF-8"?>
<!--
########### SVN repository information ###################
# $Date$
# $Author$
# $Revision$
# $HeadURL$
# $Id$
########### SVN repository information ###################
-->
<definition xmlns="http://www.nexusformat.org"
    xmlns:xsi="http://www.w3.org/2001/XMLSchema-instance"
    xsi:schemaLocation="http://www.nexusformat.org nxdl.xsd"
    name="NXevent_data" 
	type="group" extends="NXobject">
	<doc>Time-of-flight events</doc>
	<field name="time_of_flight" type="NX_INT" units="10^n second">
		<doc>
			A list of time of flight for each event as it comes in. 
			This list is for all pulses with information to attach 
			to a particular pulse located in events_per_pulse.
		</doc>
		<dimensions>i</dimensions>
	</field>
	<field name="pixel_number" type="NX_INT">
		<doc>
			There will be extra information in the NXdetector to convert 
			pixel_number to detector_number. This list is for all pulses with 
			information to attach to a particular pulse located in events_per_pulse.
		</doc>
		<dimensions>i</dimensions>
	</field>
	<field name="pulse_time" type="NX_INT" units="10^n second">
		<doc>
			The time that each pulse started with respect to the offset
		</doc>
		<dimensions>j</dimensions>
		<attribute name="offset" type="NX_CHAR">
			<doc>ISO8601</doc>
		</attribute>
	</field>
	<field name="events_per_pulse" type="NX_INT">
		<doc>
			This connects the index "i" to the index "j". 
			The jth element is the number of events in "i" 
			that occurred during the jth pulse.
		</doc>
		<dimensions>j</dimensions>
	</field>
	<field name="pulse_height" type="NX_FLOAT" units="">
		<doc>
			If voltages from the ends of the detector are read out this 
			is where they go. This list is for all events with information 
			to attach to a particular pulse height. The information to 
			attach to a particular pulse is located in events_per_pulse.
		</doc>
		<dimensions>i,k?</dimensions>
	</field>
</definition>

