<?xml version="1.0" encoding="UTF-8"?>
<!--
########### SVN repository information ###################
# $Date$
# $Author$
# $Revision$
# $HeadURL$
# $Id$
########### SVN repository information ###################
-->
<definition xmlns="http://www.nexusformat.org"
    xmlns:xsi="http://www.w3.org/2001/XMLSchema-instance"
    xsi:schemaLocation="http://www.nexusformat.org nxdl.xsd"
    name="NXmonochromator" 
	type="group" extends="NXobject">
    <doc>This is a base class for everything which selects a wavelength or energy, be it a
    monochromator crystal, a velocity selector, a undulator or whatever
    
    expected units
    wavelength: angstrom
    energy:     eV
    </doc>
    <field name="wavelength" type="NX_FLOAT" units="NX_WAVELENGTH">
        <doc>wavelength selected</doc>
        <dimensions>[]</dimensions>
    </field> 
    <field name="wavelength_error" type="NX_FLOAT" units="NX_WAVELENGTH">
        <doc>wavelength standard deviation</doc>
        <dimensions>[]</dimensions>
    </field> 
    <field name="energy" type="NX_FLOAT" units="NX_ENERGY">
        <doc>energy selected</doc>
        <dimensions>[]</dimensions>
    </field> 
    <field name="energy_error" type="NX_FLOAT" units="NX_ENERGY">
        <doc>energy standard deviation</doc>
        <dimensions>[]</dimensions>
    </field> 
    <group type="NXdata" name="distribution"/> 
</definition>

