<?xml version="1.0" encoding="UTF-8"?>
<!-- 
# NeXus - Neutron and X-ray Common Data Format
# 
# Copyright (C) 2008 NeXus International Advisory Committee (NIAC)
# 
# This library is free software; you can redistribute it and/or
# modify it under the terms of the GNU Lesser General Public
# License as published by the Free Software Foundation; either
# version 2 of the License, or (at your option) any later version.
#
# This library is distributed in the hope that it will be useful,
# but WITHOUT ANY WARRANTY; without even the implied warranty of
# MERCHANTABILITY or FITNESS FOR A PARTICULAR PURPOSE.  See the GNU
# Lesser General Public License for more details.
#
# You should have received a copy of the GNU Lesser General Public
# License along with this library; if not, write to the Free Software
# Foundation, Inc., 59 Temple Place, Suite 330, Boston, MA  02111-1307  USA
#
# For further information, see http://www.nexusformat.org

########### SVN repository information ###################
# $Date$
# $Author$
# $Revision$
# $HeadURL$
# $Id$
########### SVN repository information ###################
-->
<definition xmlns="http://definition.nexusformat.org/schema/3.1"
    xmlns:xsi="http://www.w3.org/2001/XMLSchema-instance"
    xsi:schemaLocation="http://definition.nexusformat.org/schema/3.1 ../nxdl.xsd"
    name="NXcollimator" 
    type="group" extends="../nxdl">

    <doc>Template of a beamline collimator.</doc>
    <group type="NXgeometry">
        <doc>position, shape and size</doc>
    </group>
    <field name="type">
        <enumeration>
            <item value="Soller"/>
            <item value="radial"/>
            <item value="oscillating"/>
            <item value="honeycomb"></item>
        </enumeration>
    </field>
    <field name="soller_angle" type="NX_FLOAT" units="NX_TIME">
        <doc>Angular divergence of Soller collimator</doc>
    </field>
    <field name="divergence_x" type="NX_FLOAT">
        <doc>divergence of collimator in local x direction</doc>
    </field>
    <field name="divergence_y" type="NX_FLOAT">
        <doc>divergence of collimator in local y direction</doc>
    </field>
    <field name="frequency" type="NX_FLOAT">
        <doc>Frequency of oscillating collimator</doc>
    </field>
    <group type="NXlog" name="frequency_log">
        <doc>Log of frequency</doc>
    </group>
    <field name="blade_thickness" type="NX_FLOAT">
    </field>
    <field name="blade_spacing" type="NX_FLOAT">
    </field>
    <field name="absorbing_material">
    </field>
    <field name="transmitting_material">
    </field>
</definition>
