<?xml version="1.0" encoding="UTF-8"?>
<!--
# NeXus - Neutron and X-ray Common Data Format
# 
# Copyright (C) 2008 NeXus International Advisory Committee (NIAC)
# 
# This library is free software; you can redistribute it and/or
# modify it under the terms of the GNU Lesser General Public
# License as published by the Free Software Foundation; either
# version 2 of the License, or (at your option) any later version.
#
# This library is distributed in the hope that it will be useful,
# but WITHOUT ANY WARRANTY; without even the implied warranty of
# MERCHANTABILITY or FITNESS FOR A PARTICULAR PURPOSE.  See the GNU
# Lesser General Public License for more details.
#
# You should have received a copy of the GNU Lesser General Public
# License along with this library; if not, write to the Free Software
# Foundation, Inc., 59 Temple Place, Suite 330, Boston, MA  02111-1307  USA
#
# For further information, see http://www.nexusformat.org

########### SVN repository information ###################
# $Date: 2009-05-13 16:24:58 +0200 (Wed, 13 May 2009) $
# $Author: Pete Jemian $
# $Revision: 350 $
# $HeadURL: https://svn.nexusformat.org/definitions/trunk/applications/NXmonopd.nxdl.xml $
# $Id: NXmonopd.nxdl.xml 350 2009-05-13 14:24:58Z Pete Jemian $
########### SVN repository information ###################
-->
<definition name="NXtomophase" extends="NXobject" type="group"
    xmlns="http://definition.nexusformat.org/nxdl/3.1"
    xmlns:xsi="http://www.w3.org/2001/XMLSchema-instance"
    xsi:schemaLocation="http://definition.nexusformat.org/nxdl/3.1 ../nxdl.xsd ">
    <doc>This is the application definition for x-ray or neutron tomography raw data with phase contrast variation at each point. In tomography first 
          some dark field images are measured, some bright field images and, of course the sample. In order 
          to properly sort the order of the images taken, a sequence number is stored with each image.</doc>
    <group type="NXentry" name="entry">
      <field name="title" />
      <field name="start_time" type="NX_DATE_TIME" />
      <field name="end_time" type="NX_DATE_TIME" />
      <field name="definition">
        <doc>
          Official NeXus DTD or NXDL schema to which this file conforms
        </doc>
        <enumeration>
          <item value="NXtomo"></item>
        </enumeration>
      </field>
      <group type="NXinstrument" name="instrument">
        <group type="NXsource">
          <field name="type" />
          <field name="name" />
          <field name="probe">
            <enumeration>
              <item value="neutron" />
              <item value="x-ray" />
              <item value="electron" />
            </enumeration>
          </field>
        </group>
        <group type="NXdetector" name="bright_field">
          <field name="data" type="NX_INT">
            <dimensions size="3">
              <dim index="1" value="nBrightFrames" /><dim index="2"
                value="xsize" /><dim index="3" value="ysize" />
            </dimensions>
          </field>
          <field name="sequence_number">
            <dimensions size="1">
              <dim index="1" value="nBrightFrames" />
            </dimensions></field>
        </group>
        <group type="NXdetector" name="dark_field">
          <field name="data" type="NX_INT">
            <dimensions size="3">
              <dim index="1" value="nDarkFrames" /><dim index="2"
                value="xsize" /><dim index="3" value="ysize" />
            </dimensions>
          </field>
          <field name="sequence_number">
            <dimensions size="1">
              <dim index="1" value="nDarkFrames" />
            </dimensions></field>
        </group>
        <group type="NXdetector" name="sample">
          <field name="data" type="NX_INT">
            <dimensions size="4">
              <dim index="1" value="nSampleFrames" /><dim index="2"
                value="nPhase" /><dim index="3" value="xsize" /><dim
                index="4" value="ysize" />
            </dimensions>
          </field>
          <field name="sequence_number">
            <dimensions size="2">
              <dim index="1" value="nSampleFrames" /><dim index="2"
                value="nPhase" />
            </dimensions></field>
          <field name="x_pixel_size" type="NX_FLOAT" units="NX_LENGTH"></field>
          <field name="y_pixel_size" type="NX_FLOAT" units="NX_LENGTH"></field>
          <field name="distance" type="NX_FLOAT" units="NX_LENGTH">
            <doc>Distance between detector and sample</doc></field>
        </group>
      </group>
      <group type="NXsample" name="sample">
        <field name="name">
          <doc>Descriptive name of sample</doc>
        </field>
        <field name="rotation_angle" type="NX_FLOAT" units="NX_ANGLE">
          <dimensions size="1">
            <dim index="1" value="nSampleFrames" /></dimensions></field>
      </group>
      <group type="NXmonitor" name="control">
        <field name="integral" type="NX_FLOAT" units="NX_ANY">
          <doc>Total integral monitor counts for each measured frame. This is in order to correct for fluctuations in the beam between frames</doc>
          <dimensions size="1">
            <dim index="1" value="nDarkFrames + nBrightFrames + nSampleFrame" /></dimensions>
        </field>
      </group>
      <group type="NXdata" name="data">
          <field name="data" type="NX_INT">
            <doc>Link to /entry/instrument/sample/data</doc>
            <dimensions size="4">
              <dim index="1" value="nSampleFrames" /><dim index="2"
                value="nPhase" /><dim index="3" value="xsize" /><dim
                index="4" value="ysize" />
            </dimensions>
          </field>
        <field name="rotation_angle" type="NX_FLOAT" units="NX_ANGLE">
          <doc>Link to /entry/sample/rotation_angle</doc>
          <dimensions size="1">
            <dim index="1" value="nSampleFrames" /></dimensions></field>
        </group>
    </group>
</definition>
