<?xml version="1.0" encoding="UTF-8"?>
<!--
# NeXus - Neutron and X-ray Common Data Format
# 
# Copyright (C) 2008 NeXus International Advisory Committee (NIAC)
# 
# This library is free software; you can redistribute it and/or
# modify it under the terms of the GNU Lesser General Public
# License as published by the Free Software Foundation; either
# version 2 of the License, or (at your option) any later version.
#
# This library is distributed in the hope that it will be useful,
# but WITHOUT ANY WARRANTY; without even the implied warranty of
# MERCHANTABILITY or FITNESS FOR A PARTICULAR PURPOSE.  See the GNU
# Lesser General Public License for more details.
#
# You should have received a copy of the GNU Lesser General Public
# License along with this library; if not, write to the Free Software
# Foundation, Inc., 59 Temple Place, Suite 330, Boston, MA  02111-1307  USA
#
# For further information, see http://www.nexusformat.org

########### SVN repository information ###################
# $Date$
# $Author$
# $Revision$
# $HeadURL$
# $Id$
########### SVN repository information ###################
-->
<definition xmlns="http://definition.nexusformat.org/schema/3.1"
	xmlns:xsi="http://www.w3.org/2001/XMLSchema-instance"
	xsi:schemaLocation="http://definition.nexusformat.org/schema/3.1 ../nxdl.xsd"
    name="NXsource" 
	type="group" extends="NXobject">
	<doc>Template of the neutron or x-ray source, insertion devices and/or moderators.</doc>
	<field name="distance" type="NX_FLOAT" units="NX_LENGTH">
		<doc>
			Effective distance from sample
			Distance as seen by radiation from sample. This number should be negative 
			to signify that it is upstream of the sample.
		</doc>
	</field>
	<field name="name">
		<doc>
			Name of source
		</doc>
	</field>
	<field name="type">
		<doc>type of radiation source</doc>
		<enumeration>
			<item value="Spallation Neutron Source" />
			<item value="Pulsed Reactor Neutron Source" />
			<item value="Reactor Neutron Source" />
			<item value="Synchrotron X-ray Source" />
			<item value="Pulsed Muon Source" />
			<item value="Rotating Anode X-ray" />
			<item value="Fixed Tube X-ray" />
		</enumeration>
	</field>
	<field name="probe">
		<doc>type of radiation probe</doc>
		<enumeration>
			<item value="neutron" />
			<item value="x-ray" />
			<item value="muon" />
			<item value="electron" />
		</enumeration>
	</field>
	<field name="power" type="NX_FLOAT" units="NX_POWER">
		<doc>Source power</doc>
	</field>
	<field name="current" type="NX_FLOAT" units="NX_CURRENT">
		<doc>Accelerator current</doc>
	</field>
	<field name="voltage" type="NX_FLOAT" units="NX_VOLTAGE">
		<doc>Accelerator voltage</doc>
	</field>
	<field name="frequency" type="NX_FLOAT" units="NX_FREQUENCY">
		<doc>Frequency of pulsed source</doc>
	</field>
	<field name="period" type="NX_FLOAT" units="NX_PERIOD">
		<doc>Period of pulsed source</doc>
	</field>
	<field name="target_material">
		<doc>Pulsed source target material</doc>
		<enumeration>
			<item value="Ta" />
			<item value="W" />
			<item value="depleted_U" />
			<item value="enriched_U" />
			<item value="Hg" />
			<item value="Pb" />
			<item value="C" />
		</enumeration>
	</field>
	<field name="notes">
		<doc>
			any source/facility related messages/events that 
			occurred during the experiment
		</doc>
	</field>
	<field name="pulse_width" type="NX_FLOAT" units="NX_TIME">
		<doc>width of source pulse</doc>
	</field>
	<group name="pulse_shape" type="NXdata">
		<doc>source pulse shape</doc>
	</group>
	<field name="mode">
		<doc>source operating mode</doc>
		<enumeration>
			<item value="Single Bunch" />
			<item value="Multi Bunch" />
		</enumeration>
	</field>
	<field name="top_up" type="NX_BOOLEAN">
		<doc>Is the synchrotron operating in top_up mode?</doc>
	</field>
	<group name="geometry" type="NXgeometry">
		<doc>"Engineering" location of source</doc>
	</group>
</definition>
