<?xml version="1.0" encoding="UTF-8"?>
<!--
########### SVN repository information ###################
# $Date$
# $Author$
# $Revision$
# $HeadURL$
# $Id$
########### SVN repository information ###################
-->
<definition xmlns="http://www.nexusformat.org"
    xmlns:xsi="http://www.w3.org/2001/XMLSchema-instance"
    xsi:schemaLocation="http://www.nexusformat.org nxdl.xsd"
    name="NXbeam_stop"
    type="group" extends="NXobject">
    <doc>A class for a beamstop. Beamstops and their positions are important for SANS
    and SAXS experiments.</doc>
    <group type="NXgeometry">
        <doc>engineering shape, orientation and position of the beam stop.</doc>
    </group>
    <field name="description" type="NX_CHAR">
        <doc>description of beamstop</doc>
        <enumeration>
            <item value="circular"/>
            <item value="rectangular"/>
        </enumeration>
        </field>
    <field name="size" type="NX_FLOAT" units="cm">
        <doc>size of beamstop</doc>
    </field>
    <field name="x" type="NX_FLOAT" units="cm">
        <doc>x position of the beamstop in relation to the detector</doc>
    </field>
    <field name="y" type="NX_FLOAT" units="cm">
        <doc>y position of the beamstop in relation to the detector</doc>
    </field>
    <field name="distance_to_detector" type="NX_FLOAT" units="cm">
        <doc>distance of the beamstop to the detector</doc>
    </field>
    <field name="status" type="NX_CHAR">
        <enumeration>
            <item value="in"/>
            <item value="out"/>
        </enumeration>
    </field>
</definition>